{
  "schema_version": 1,
  "block_id": "49fa53b5-8703-4120-9f1f-1fbf849c1471",
  "component": "health_status",
  "title": "Executor health",
  "data_bindings": [
    {
      "slot": "health",
      "source": "desktop_host",
      "reference_kind": "plugin_id",
      "reference_id": "@catomicals/plugin-executor-codex"
    }
  ],
  "action_bindings": [
    {
      "action_id": "open-health",
      "action": "open_health",
      "target_binding": "health"
    }
  ]
}
